{
  "$schema": "../../../../../tools/schemas/boon.schema.json",
  "version": 1,
  "id": "tyr-strike",
  "name": "Tyr's Strike",
  "kind": "sigil",
  "lineage": "norse",
  "description": "Your weapon learns Strike: a heavy blow on anything within reach.",
  "requires": { "slot": "weapon" },
  "effects": [
    { "type": "grantAbility", "target": "weapon", "ability": "strike" }
  ],
  "icon": "tyr-strike"
}
